{
  "$schema": "../../../schemas/skill.schema.json",
  "id": "engineering.architecture",
  "name": "Architecture",
  "version": "1.0.0",
  "owner": { "name": "cmm07t83", "email": "cmm07t83@gmail.com" },
  "description": "Expert en architecture logicielle : style, découpage, DDD, Clean, Hexagonal, monolithe/microservices, ADR et diagrammes.",
  "category": "engineering",
  "tags": ["architecture", "ddd", "clean", "hexagonal", "adr"],
  "capabilities": ["architecture-style", "ddd", "clean-architecture", "hexagonal", "microservices", "monolith", "adr", "diagrams"],
  "dependencies": [],
  "priority": 60,
  "estimatedCost": { "unit": "tokens", "typical": 7000 },
  "qualityLevel": "stable",
  "maturityLevel": "stable",
  "recommendedModels": ["claude-opus-4-8", "claude-sonnet-5"],
  "inputs": ["brief", "files", "prior"],
  "outputs": { "outputFormat": "markdown", "sections": ["Contexte & contraintes", "Options comparées", "Décision", "Vue composants", "Vue séquence", "Découpage", "ADR", "Hand-off"] },
  "compatibleCommands": ["architecture", "sds", "orchestrate"],
  "compatibility": { "framework": ">=2.0.0 <3.0.0" },
  "knowledge": [{ "file": "knowledge/overview.md", "capabilities": ["architecture-style", "adr"], "tokensApprox": 450 }],
  "examples": [],
  "documentation": "README.md",
  "entry": "SKILL.md"
}
