{
  "$schema": "../../../schemas/skill.schema.json",
  "id": "engineering.backend",
  "name": "Backend",
  "version": "1.0.0",
  "owner": { "name": "cmm07t83", "email": "cmm07t83@gmail.com" },
  "description": "Expert backend serveur : services, workers, queues, cache, intégration auth, logging et observabilité.",
  "category": "engineering",
  "tags": ["backend", "services", "queues", "cache"],
  "capabilities": ["services", "workers", "queues", "auth-integration", "caching", "logging", "observability-hooks"],
  "dependencies": [{ "capability": "jwt", "range": ">=1.0.0 <2.0.0" }],
  "priority": 55,
  "estimatedCost": { "unit": "tokens", "typical": 6500 },
  "qualityLevel": "stable",
  "maturityLevel": "stable",
  "recommendedModels": ["claude-sonnet-5", "claude-opus-4-8"],
  "inputs": ["brief", "files", "prior"],
  "outputs": { "outputFormat": "markdown", "sections": ["Arborescence", "Services & use-cases", "Asynchrone", "Cache", "Observabilité", "Erreurs & validation", "Config & secrets", "Hand-off"] },
  "compatibleCommands": ["backend", "sds", "orchestrate"],
  "compatibility": { "framework": ">=2.0.0 <3.0.0" },
  "knowledge": [{ "file": "knowledge/overview.md", "capabilities": ["queues", "caching"], "tokensApprox": 420 }],
  "examples": [],
  "documentation": "README.md",
  "entry": "SKILL.md"
}
