{
  "$schema": "../../../../schemas/skill.schema.json",
  "id": "documentation.greeter",
  "name": "Greeter",
  "version": "1.0.0",
  "owner": { "name": "example", "email": "example@example.com" },
  "description": "Skill d'exemple fourni par une extension : génère un message d'accueil.",
  "category": "documentation",
  "tags": ["example", "greeting"],
  "capabilities": ["greeting"],
  "dependencies": [],
  "priority": 40,
  "estimatedCost": { "unit": "tokens", "typical": 500 },
  "qualityLevel": "beta",
  "maturityLevel": "beta",
  "recommendedModels": ["claude-haiku-4-5-20251001"],
  "inputs": ["brief"],
  "outputs": { "outputFormat": "markdown", "sections": ["Message", "Hand-off"] },
  "compatibleCommands": ["orchestrate"],
  "compatibility": { "framework": ">=2.0.0 <6.0.0" },
  "knowledge": [],
  "examples": [],
  "documentation": "SKILL.md",
  "entry": "SKILL.md"
}
