{
  "$schema": "../../../schemas/skill.schema.json",
  "id": "engineering.api",
  "name": "API",
  "version": "1.0.0",
  "owner": { "name": "cmm07t83", "email": "cmm07t83@gmail.com" },
  "description": "Expert API REST : contrats d'endpoints, OpenAPI 3.1, versioning, pagination, format d'erreurs, idempotence, webhooks.",
  "category": "engineering",
  "tags": ["api", "rest", "openapi", "webhooks"],
  "capabilities": ["openapi", "rest", "endpoints", "versioning", "pagination", "error-format", "webhooks", "idempotency"],
  "dependencies": [{ "capability": "postgres-schema", "range": ">=1.0.0 <2.0.0" }],
  "priority": 55,
  "estimatedCost": { "unit": "tokens", "typical": 6000 },
  "qualityLevel": "stable",
  "maturityLevel": "stable",
  "recommendedModels": ["claude-sonnet-5", "claude-opus-4-8"],
  "inputs": ["brief", "files", "prior"],
  "outputs": { "outputFormat": "markdown", "sections": ["Conventions", "Endpoints", "Détail par endpoint", "OpenAPI", "Webhooks", "Rate limiting & idempotence", "Hand-off"] },
  "compatibleCommands": ["api", "sds", "orchestrate"],
  "compatibility": { "framework": ">=2.0.0 <3.0.0" },
  "knowledge": [{ "file": "knowledge/overview.md", "capabilities": ["error-format", "pagination", "idempotency"], "tokensApprox": 440 }],
  "examples": [],
  "documentation": "README.md",
  "entry": "SKILL.md"
}
