{
  "$schema": "../../../schemas/skill.schema.json",
  "id": "engineering.database",
  "name": "Database",
  "version": "1.0.0",
  "owner": { "name": "cmm07t83", "email": "cmm07t83@gmail.com" },
  "description": "Expert PostgreSQL : schémas, relations, contraintes, index, migrations sûres et optimisation des requêtes.",
  "category": "engineering",
  "tags": ["postgresql", "sql", "migrations", "index"],
  "capabilities": ["postgres-schema", "indexing", "migrations", "relations", "query-optimization", "er-diagram"],
  "dependencies": [],
  "priority": 55,
  "estimatedCost": { "unit": "tokens", "typical": 6000 },
  "qualityLevel": "stable",
  "maturityLevel": "stable",
  "recommendedModels": ["claude-sonnet-5", "claude-opus-4-8"],
  "inputs": ["brief", "files", "prior"],
  "outputs": { "outputFormat": "markdown", "sections": ["Diagramme ER", "Tables", "Index", "Normalisation / dénormalisation", "Migrations", "Performance", "Hand-off"] },
  "compatibleCommands": ["database", "sds", "orchestrate"],
  "compatibility": { "framework": ">=2.0.0 <3.0.0" },
  "knowledge": [{ "file": "knowledge/overview.md", "capabilities": ["indexing", "migrations"], "tokensApprox": 430 }],
  "examples": [],
  "documentation": "README.md",
  "entry": "SKILL.md"
}
